{
  "schema_version": "1.0.0",
  "document_type": "review-source-summary",
  "document_id": "fixture-summary_001",
  "created_at": "2026-01-01T00:00:00Z",
  "workspace": "workspace_demo",
  "source_id": "src_synthetic_01",
  "source_hash": {
    "algorithm": "sha256",
    "value": "1111111111111111111111111111111111111111111111111111111111111111"
  },
  "review_generation": 1,
  "producer": {
    "kind": "ENGINE",
    "name": "s9k-data-engine",
    "version": "0.0.0-test",
    "model": null
  },
  "provenance": {
    "source_id": "src_synthetic_01",
    "source_hash": {
      "algorithm": "sha256",
      "value": "1111111111111111111111111111111111111111111111111111111111111111"
    },
    "review_generation": 1,
    "pipeline_version": "0.0.0-test",
    "producer": {
      "kind": "ENGINE",
      "name": "s9k-data-engine",
      "version": "0.0.0-test",
      "model": null
    }
  },
  "source_kind": "TEXT",
  "source_document": "synthetic_01.md",
  "status": "READY",
  "segments_total": 3,
  "segments_reviewed": 3,
  "candidates_total": 3,
  "pending": 0,
  "auto_approvable": 0,
  "approved": 3,
  "edited": 0,
  "use_existing": 0,
  "deferred": 0,
  "conflicts": 0,
  "rejected": 0,
  "ready_to_plan": true,
  "blocking_reasons": [],
  "updated_at": "2026-01-01T00:09:00Z"
}
